{"$id":"https://inferswarm.dev/schema/issue86/sealed-holdout-commitment-1.json","$schema":"https://json-schema.org/draft/2020-12/schema","additionalProperties":false,"properties":{"case_count":{"const":24},"cells":{"items":{"additionalProperties":false,"properties":{"case_id":{"pattern":"^h86-","type":"string"},"case_sha256":{"pattern":"^[0-9a-f]{64}$","type":"string"},"content_class":{"type":"string"},"length_regime":{"items":{"type":"integer"},"maxItems":2,"minItems":2,"type":"array"},"prompt_sha256":{"pattern":"^[0-9a-f]{64}$","type":"string"},"token_count":{"type":"integer"},"token_ids_sha256":{"pattern":"^[0-9a-f]{64}$","type":"string"}},"required":["case_id","content_class","length_regime","token_count","prompt_sha256","token_ids_sha256","case_sha256"],"type":"object"},"maxItems":24,"minItems":24,"type":"array"},"cipher":{"const":"CMS EnvelopedData; AES-256-CBC; RSA-3072 recipient"},"ciphertext_sha256":{"pattern":"^[0-9a-f]{64}$","type":"string"},"contract_id":{"const":"inferswarm.gemma4-heterogeneous-numerical-equivalence/1"},"generator":{"type":"string"},"generator_sha256":{"pattern":"^[0-9a-f]{64}$","type":"string"},"historical_h74_ciphertext_sha256":{"const":"23311c5514b2561c66a2ecd0c9cfa25c3f4f91b83b67353aada8355f48e25c59"},"historical_h74_holdout_reuse":{"const":"PROHIBITED_PERMANENTLY"},"plaintext_retention":{"const":"PROHIBITED_IN_REPOSITORY"},"recipient_certificate_sha256":{"pattern":"^[0-9a-f]{64}$","type":"string"},"schema":{"const":"inferswarm.issue86.v3-holdout-commitment/1"},"secret_seed_sha256":{"pattern":"^[0-9a-f]{64}$","type":"string"},"state":{"const":"SEALED_NOT_CONSUMED"},"tokenizer_json_sha256":{"pattern":"^[0-9a-f]{64}$","type":"string"},"unseal_rule":{"type":"string"}},"required":["schema","contract_id","state","case_count","cells","secret_seed_sha256","generator","generator_sha256","tokenizer_json_sha256","cipher","ciphertext_sha256","recipient_certificate_sha256","unseal_rule","plaintext_retention","historical_h74_holdout_reuse","historical_h74_ciphertext_sha256"],"title":"InferSwarm issue #86 v3 public sealed-holdout commitment","type":"object"}
