{"case_count":24,"cells":[{"case_id":"h86-01-01-01","case_sha256":"6bf01a901dd514704125a2a793b5bd99aec2eb83a54082e2f490020c4a35ff07","content_class":"ordinary-prose","length_regime":[4,8],"prompt_sha256":"75c1e5ef2038d5a790bdd5e46abf20ed8e2e2c757446985f3157386ebf679527","token_count":4,"token_ids_sha256":"00e5c65b06a2c11847ea7850842c3a093463c7cc0c298eaa581f4a9a140262b2"},{"case_id":"h86-02-01-01","case_sha256":"4981ba610b2fe32fb0456de1d94309738815e09de6dcab09dcb31590f851c38a","content_class":"ordinary-prose","length_regime":[24,28],"prompt_sha256":"ebf5c02b77e0dfb196ca473e2df0b7924d4093bdf13ea207fd7915dca5e2d833","token_count":24,"token_ids_sha256":"d407da01c32a7f546212a1631e303774d4fcf9af9c5741ef9364474bb2890796"},{"case_id":"h86-03-01-01","case_sha256":"46199dfb59d68728ccde4d4ffd60c39a02d9258529452f061b439e36d6dcefce","content_class":"ordinary-prose","length_regime":[36,40],"prompt_sha256":"6ef6344e9270877da54e251db5676a4f32e5ca4893dbb96017dca67844259f21","token_count":36,"token_ids_sha256":"39b93a750459945a3c14b4648fee83b2ae0cab21797499a8bd1f42aad57f806e"},{"case_id":"h86-04-01-01","case_sha256":"dc3653df4c9d734746a1e722c991a49477346e39dc638d9435152ce8ec348e88","content_class":"ordinary-prose","length_regime":[52,56],"prompt_sha256":"d45e39d6d41a668e3ba839850cbad1de13688eccec693fe006937bf6c18c918d","token_count":52,"token_ids_sha256":"c0f66ec529d36ca19c93fe8056e9c1ac4965f1f6733d0e8f7454524d4be6b5e1"},{"case_id":"h86-01-02-01","case_sha256":"7fe5288af3ff8ce22f265797cd0e2be497b3aaab5f53bce990e6e051df5bba11","content_class":"source-code-structured-syntax","length_regime":[4,8],"prompt_sha256":"b1197a444c20144967a8f872bd98eac382addea98934ac45f20b6fa1f4b3e6f2","token_count":4,"token_ids_sha256":"e8a6f66f915df0b3f198280b7588e950943de029d212974566675f412d2dc982"},{"case_id":"h86-02-02-01","case_sha256":"f1c09928a6b7a688614ba3e80ce0b7935802032b90ef680a6904acfb96d10a76","content_class":"source-code-structured-syntax","length_regime":[24,28],"prompt_sha256":"70bd5e0c5faf1018e20ce801ffc53cd8fbdd5c8bf45a709cbfc88a360379dfdf","token_count":24,"token_ids_sha256":"468aff93fb92b026d18b21d4df4ee8083c4bd55df78edce73332aec86d7f591e"},{"case_id":"h86-03-02-01","case_sha256":"535e85b9fc9a7992e5ceb1af639c42924fe8bf7b251d0b608286452688c9e45d","content_class":"source-code-structured-syntax","length_regime":[36,40],"prompt_sha256":"bae9bac4d6b6ec66e1e317f870cdf7253b08fffd7b25f016f85b855ae447917d","token_count":36,"token_ids_sha256":"96eb42bae8a94947daadcb867125b7257fbf18c80adf2763b6aa12ffae6e3436"},{"case_id":"h86-04-02-01","case_sha256":"b05197f771540e5f3035ee9acc78f8ddf4905795333c704f7fac14983ac06efd","content_class":"source-code-structured-syntax","length_regime":[52,56],"prompt_sha256":"5543348da4ad85dfa42110291843365f49b3ef2d9c4c647252e48d4d2d1c9bb2","token_count":52,"token_ids_sha256":"dc43c64fc639faed7d9dfab7aee955d3584796868a1369cb56f7c58a40ba0253"},{"case_id":"h86-01-03-01","case_sha256":"0655c76fcd2562b0706534e5618ec00184a246d71749561ee327e3b47f3afdde","content_class":"mathematics-numerals","length_regime":[4,8],"prompt_sha256":"96e4d8948b1ec3c40b4b458e97dfefbebbee5f0932108b53b5acb145e015bec8","token_count":4,"token_ids_sha256":"542355f15cfc7b256a0816565b0dbb1f9fdcf6cffc32d263fca79afaa6c523b8"},{"case_id":"h86-02-03-01","case_sha256":"9878aa9593e53e46f65967d1f86f2128aec761e4ff80bb7207e3d9c7f8323dfb","content_class":"mathematics-numerals","length_regime":[24,28],"prompt_sha256":"2bdaafccd643eb62332a9967334ece90779264fd1261b2bf8515770cc9f3f791","token_count":24,"token_ids_sha256":"1886d85b83318e1a41a774284df30421ad7b6630c2fc287ab9896fb55145f687"},{"case_id":"h86-03-03-01","case_sha256":"b71f12c4bd67d0e0112792094fb53a4b9effbad180027e739bdbe74963445a89","content_class":"mathematics-numerals","length_regime":[36,40],"prompt_sha256":"97bf8e8de247d5185787cc937fafacebd091694bd182f1c7435c9cad6f69bf2b","token_count":36,"token_ids_sha256":"be332eca17942745604eb0a1c9feb69751342499f4add4055262f25a8855f11b"},{"case_id":"h86-04-03-01","case_sha256":"526c8bfa7f32e62c77a8a5a138f7d25e56b30ef82436f57c98fefa8442b79d98","content_class":"mathematics-numerals","length_regime":[52,56],"prompt_sha256":"318591a7060ebf2140c542983254601a832cfaa563358af07b9c079b37379118","token_count":52,"token_ids_sha256":"676fd6af7f15ae2d8846ea479a4602238b67fdbf31f80a7b3721f34ba3822f26"},{"case_id":"h86-01-04-01","case_sha256":"e65af5c139f1c7bdcebb3e2094952921b6475627134f1eb777ff35e6ad7af33e","content_class":"multilingual-text","length_regime":[4,8],"prompt_sha256":"e587f7ed13ead44c44d3663a5a45c0bf17144e26ac4c20783e9f49383f4e6a2d","token_count":4,"token_ids_sha256":"756895bd5e19823616e17aa0e6fbf02bf91c815f9e7edab6a45c61aab50a5cd6"},{"case_id":"h86-02-04-01","case_sha256":"42ead01755f289a0eaa59e54cddf1d03d61c7e0405b5bf73d11787c2d42ad363","content_class":"multilingual-text","length_regime":[24,28],"prompt_sha256":"26bd89099a7344aada2917b040b65a7f61f37f8a6b980c182dd842102b4b32f8","token_count":24,"token_ids_sha256":"796586e2ba6efc0ecd887bc0695eee0b13a2bbf08c35543c20f9eb66560f1f2f"},{"case_id":"h86-03-04-01","case_sha256":"c41636e5e8671c269e9ce0a80572b3430ae626fa10e2bc609011104db975991b","content_class":"multilingual-text","length_regime":[36,40],"prompt_sha256":"07a0b55e953cee511080df54f9b80bae282fb61be768275e802e38a5d82e8f34","token_count":36,"token_ids_sha256":"772b1ecffab928b134826f6d207bdec60dc24638e0d1afadd2e87715fd5e10d6"},{"case_id":"h86-04-04-01","case_sha256":"7987c4df9bf6c2ae28c85209a54e1c9ca6063ec7a00186dcb4fb0d453520b2b9","content_class":"multilingual-text","length_regime":[52,56],"prompt_sha256":"a712860a60eb34085002f7f3d3d17d8d564d48bf3a05373ae8786320fa2fdc1b","token_count":52,"token_ids_sha256":"f932be7299faa742f5572be1eaeb148f480918c93e7c9d55bca4c670b5f2f3ee"},{"case_id":"h86-01-05-01","case_sha256":"65b003928cad4c44184d772e4da824e9e6a3b1c03f1db7a83e15a2a01e4160b2","content_class":"repetitive-low-entropy","length_regime":[4,8],"prompt_sha256":"83ace635c61ebab75d274fe5525a399f71efa0d532d77a123fac6150811fd130","token_count":4,"token_ids_sha256":"9aef36b91615928a95d8374170d6c3b9403c3429f24c6f20e5a3160fcde0bd50"},{"case_id":"h86-02-05-01","case_sha256":"882bc934741b9f55a8a71a90c6d081892598319f25d80a229d571c0742fcc0df","content_class":"repetitive-low-entropy","length_regime":[24,28],"prompt_sha256":"36d36733135a88e93460c6aca17866a428f93598064286d13942ac10b848943c","token_count":24,"token_ids_sha256":"041da01ddd4a0462135a00f6ad9b45c4ff2d97e699e3ae607b68724e19290abf"},{"case_id":"h86-03-05-01","case_sha256":"e32d3879df2283493d90dd71244bd1c66b83bd4fc93367dc08fc4f1af723c802","content_class":"repetitive-low-entropy","length_regime":[36,40],"prompt_sha256":"f8a02cd54826f2cac943404ab29c20354120aaeee8b7c20163425551e4a5cb21","token_count":36,"token_ids_sha256":"19dab280b2678fea03e73ec589658dde22937fbb3bd4ef7a1e2f40a0e38c96b6"},{"case_id":"h86-04-05-01","case_sha256":"12b07973a2c143eff1dc9c9bf1638cbe54660a7b83df0c5ef60141cfdba76c8d","content_class":"repetitive-low-entropy","length_regime":[52,56],"prompt_sha256":"066b93e10e6aad788ea11baad15761b5d16f0f1805c821d97244b4886e8addee","token_count":52,"token_ids_sha256":"e6b0f7a0593c226fb77cba687e053ae04c1e173bd488ba24060c3195dd1e2504"},{"case_id":"h86-01-06-01","case_sha256":"f6221f445dbc189c9527a9be7666ae0e9e9708273788c14c683f60548b688129","content_class":"punctuation-whitespace-rare-high-entropy","length_regime":[4,8],"prompt_sha256":"12a8183ab00e9d03b2f7d0d74867a2e7bc66dbbe5878295c53b71b27f9fe8193","token_count":4,"token_ids_sha256":"2837a6aa051021c625b978402b9d202c03bb5cc0071f67e14832c969c2e82114"},{"case_id":"h86-02-06-01","case_sha256":"9cf451636570b059b33836053b89fac3b28c8e5e4e884d87e72e83a55f448ae0","content_class":"punctuation-whitespace-rare-high-entropy","length_regime":[24,28],"prompt_sha256":"ff0eecf18cd62d22fd4b42cfa4d17225cfb0a8e58d33dc96d69897e48200ea6f","token_count":24,"token_ids_sha256":"225f177acca76402bbd142f3b1428e648dfcb0a93ae1c728ddc833c47a42169e"},{"case_id":"h86-03-06-01","case_sha256":"c18c7b99a87b8c945ce32d0985386d47188f882c0e0d8854f0fabc3e672a254f","content_class":"punctuation-whitespace-rare-high-entropy","length_regime":[36,40],"prompt_sha256":"95abd4c56d2d65a7632cd5053714b98ad75590d777f13883a2c4394b921af8a5","token_count":36,"token_ids_sha256":"7155e7d04775c0ae876877d9c93aafdaa553db161f1433f7048297d00b23c3c4"},{"case_id":"h86-04-06-01","case_sha256":"6878f46d2eb2e92a0d32509080a29c737b7e3fdc30f7dc049e8e822322a3a9dc","content_class":"punctuation-whitespace-rare-high-entropy","length_regime":[52,56],"prompt_sha256":"d5853ff2218c2a14c938c882d3febdd321591bc1b5084c4d9803ed13ee6d4c28","token_count":52,"token_ids_sha256":"ec7a91bc9f032ecc37f2e3ae7b425c805cc7c605aa92dde08aaa57f7e87e392d"}],"cipher":"CMS EnvelopedData; AES-256-CBC; RSA-3072 recipient","ciphertext_sha256":"7dc3af038ac1e6a71bfb4b7088a1a43f4366dfe991e212c3cbd2794e58e4dac8","contract_id":"inferswarm.gemma4-heterogeneous-numerical-equivalence/1","generator":"scripts/generate_issue86_corpora.py","generator_sha256":"02ba9adcc806cc6f32dae18fdf2be2ea438b88bd7019aee7e8d22f2f7dc28dd0","historical_h74_ciphertext_sha256":"23311c5514b2561c66a2ecd0c9cfa25c3f4f91b83b67353aada8355f48e25c59","historical_h74_holdout_reuse":"PROHIBITED_PERMANENTLY","plaintext_retention":"PROHIBITED_IN_REPOSITORY","recipient_certificate_sha256":"680a01b722b28e6e147ace0bb6ade3f3dfc1915afdda480498f97de3042d1542","schema":"inferswarm.issue86.v3-holdout-commitment/1","secret_seed_sha256":"0d55476a07bc981f93b3a3c01c7bfc4bdab35eada2042b726658ad91b6d842b8","state":"SEALED_NOT_CONSUMED","tokenizer_json_sha256":"cc8d3a0ce36466ccc1278bf987df5f71db1719b9ca6b4118264f45cb627bfe0f","unseal_rule":"only after the v3 threshold manifest is committed and the v3 unseal preflight passes; only by the maintainer's explicit act"}
